{
  "case_lineage": {
    "path": "evaluation/model-evolution/confirmatory-v1/skill-evaluator-case-lineage-v1.json",
    "root": "campaign",
    "schema_version": "se-confirmatory-case-lineage/1"
  },
  "catalog_files": [
    {
      "path": "evaluation/model-evolution/confirmatory-v1/bundle-revision-policy-v2.json",
      "root": "campaign",
      "schema_version": "frontier-bundle-revision-policy/2"
    },
    {
      "path": "evaluation/model-evolution/confirmatory-v1/manual-authority-packet-v1.schema.json",
      "root": "campaign",
      "schema_version": "json/1"
    },
    {
      "path": "evaluation/model-evolution/confirmatory-v1/manual-authority-protocol-v1.json",
      "root": "campaign",
      "schema_version": "manual-authority-protocol/1"
    },
    {
      "path": "evaluation/model-evolution/confirmatory-v1/sentinels/long-document-segmented-writing/calibration-gold.jsonl",
      "root": "campaign",
      "schema_version": "jsonl/3"
    },
    {
      "path": "evaluation/model-evolution/confirmatory-v1/sentinels/long-document-segmented-writing/eval-spec.template.json",
      "root": "campaign",
      "schema_version": "7"
    },
    {
      "path": "evaluation/model-evolution/confirmatory-v1/sentinels/long-document-segmented-writing/fixtures/completion.md",
      "root": "campaign",
      "schema_version": "text/utf-8"
    },
    {
      "path": "evaluation/model-evolution/confirmatory-v1/sentinels/long-document-segmented-writing/fixtures/draft.md",
      "root": "campaign",
      "schema_version": "text/utf-8"
    },
    {
      "path": "evaluation/model-evolution/confirmatory-v1/sentinels/long-document-segmented-writing/fixtures/failure-ownership.md",
      "root": "campaign",
      "schema_version": "text/utf-8"
    },
    {
      "path": "evaluation/model-evolution/confirmatory-v1/sentinels/long-document-segmented-writing/fixtures/manifest.json",
      "root": "campaign",
      "schema_version": "1"
    },
    {
      "path": "evaluation/model-evolution/confirmatory-v1/sentinels/long-document-segmented-writing/fixtures/mode-selection.md",
      "root": "campaign",
      "schema_version": "text/utf-8"
    },
    {
      "path": "evaluation/model-evolution/confirmatory-v1/sentinels/long-document-segmented-writing/fixtures/recovery-state.md",
      "root": "campaign",
      "schema_version": "text/utf-8"
    },
    {
      "path": "evaluation/model-evolution/confirmatory-v1/sentinels/long-document-segmented-writing/fixtures/release.md",
      "root": "campaign",
      "schema_version": "text/utf-8"
    },
    {
      "path": "evaluation/model-evolution/confirmatory-v1/sentinels/long-document-segmented-writing/fixtures/run-a.md",
      "root": "campaign",
      "schema_version": "text/utf-8"
    },
    {
      "path": "evaluation/model-evolution/confirmatory-v1/sentinels/long-document-segmented-writing/fixtures/run-b.md",
      "root": "campaign",
      "schema_version": "text/utf-8"
    },
    {
      "path": "evaluation/model-evolution/confirmatory-v1/sentinels/long-document-segmented-writing/fixtures/service-scope.md",
      "root": "campaign",
      "schema_version": "text/utf-8"
    },
    {
      "path": "evaluation/model-evolution/confirmatory-v1/sentinels/long-document-segmented-writing/grader-output.schema.json",
      "root": "campaign",
      "schema_version": "json/1"
    },
    {
      "path": "evaluation/model-evolution/confirmatory-v1/sentinels/long-document-segmented-writing/grader-prompt.md",
      "root": "campaign",
      "schema_version": "text/utf-8"
    },
    {
      "path": "evaluation/model-evolution/confirmatory-v1/sentinels/long-document-segmented-writing/host-manifest.template.json",
      "root": "campaign",
      "schema_version": "2"
    },
    {
      "path": "evaluation/model-evolution/confirmatory-v1/sentinels/long-document-segmented-writing/scenarios.public.jsonl",
      "root": "campaign",
      "schema_version": "jsonl/1"
    },
    {
      "path": "evaluation/model-evolution/confirmatory-v1/sentinels/long-document-segmented-writing/suite-quality-proof.json",
      "root": "campaign",
      "schema_version": "1"
    },
    {
      "path": "evaluation/model-evolution/confirmatory-v1/sentinels/long-document-segmented-writing/suite-quality.json",
      "root": "campaign",
      "schema_version": "2"
    },
    {
      "path": "evaluation/model-evolution/confirmatory-v1/sentinels/long-document-segmented-writing/verify.py",
      "root": "campaign",
      "schema_version": "bytes/1"
    },
    {
      "path": "evaluation/model-evolution/confirmatory-v1/sentinels/long-document-segmented-writing/verify_common.py",
      "root": "campaign",
      "schema_version": "bytes/1"
    },
    {
      "path": "evaluation/model-evolution/confirmatory-v1/sentinels/skill-evaluator/calibration-gold.jsonl",
      "root": "campaign",
      "schema_version": "jsonl/3"
    },
    {
      "path": "evaluation/model-evolution/confirmatory-v1/sentinels/skill-evaluator/eval-spec.template.json",
      "root": "campaign",
      "schema_version": "7"
    },
    {
      "path": "evaluation/model-evolution/confirmatory-v1/sentinels/skill-evaluator/fixtures/confirmatory-analyzer-exit-01.md",
      "root": "campaign",
      "schema_version": "text/utf-8"
    },
    {
      "path": "evaluation/model-evolution/confirmatory-v1/sentinels/skill-evaluator/fixtures/confirmatory-analyzer-exit-02.md",
      "root": "campaign",
      "schema_version": "text/utf-8"
    },
    {
      "path": "evaluation/model-evolution/confirmatory-v1/sentinels/skill-evaluator/fixtures/confirmatory-analyzer-exit-03.md",
      "root": "campaign",
      "schema_version": "text/utf-8"
    },
    {
      "path": "evaluation/model-evolution/confirmatory-v1/sentinels/skill-evaluator/fixtures/confirmatory-analyzer-exit-04.md",
      "root": "campaign",
      "schema_version": "text/utf-8"
    },
    {
      "path": "evaluation/model-evolution/confirmatory-v1/sentinels/skill-evaluator/fixtures/confirmatory-analyzer-exit-05.md",
      "root": "campaign",
      "schema_version": "text/utf-8"
    },
    {
      "path": "evaluation/model-evolution/confirmatory-v1/sentinels/skill-evaluator/fixtures/confirmatory-analyzer-exit-06.md",
      "root": "campaign",
      "schema_version": "text/utf-8"
    },
    {
      "path": "evaluation/model-evolution/confirmatory-v1/sentinels/skill-evaluator/fixtures/confirmatory-analyzer-exit-07.md",
      "root": "campaign",
      "schema_version": "text/utf-8"
    },
    {
      "path": "evaluation/model-evolution/confirmatory-v1/sentinels/skill-evaluator/fixtures/confirmatory-analyzer-exit-08.md",
      "root": "campaign",
      "schema_version": "text/utf-8"
    },
    {
      "path": "evaluation/model-evolution/confirmatory-v1/sentinels/skill-evaluator/fixtures/confirmatory-authority-boundary-01.md",
      "root": "campaign",
      "schema_version": "text/utf-8"
    },
    {
      "path": "evaluation/model-evolution/confirmatory-v1/sentinels/skill-evaluator/fixtures/confirmatory-authority-boundary-02.md",
      "root": "campaign",
      "schema_version": "text/utf-8"
    },
    {
      "path": "evaluation/model-evolution/confirmatory-v1/sentinels/skill-evaluator/fixtures/confirmatory-authority-boundary-03.md",
      "root": "campaign",
      "schema_version": "text/utf-8"
    },
    {
      "path": "evaluation/model-evolution/confirmatory-v1/sentinels/skill-evaluator/fixtures/confirmatory-authority-boundary-04.md",
      "root": "campaign",
      "schema_version": "text/utf-8"
    },
    {
      "path": "evaluation/model-evolution/confirmatory-v1/sentinels/skill-evaluator/fixtures/confirmatory-authority-boundary-05.md",
      "root": "campaign",
      "schema_version": "text/utf-8"
    },
    {
      "path": "evaluation/model-evolution/confirmatory-v1/sentinels/skill-evaluator/fixtures/confirmatory-authority-boundary-06.md",
      "root": "campaign",
      "schema_version": "text/utf-8"
    },
    {
      "path": "evaluation/model-evolution/confirmatory-v1/sentinels/skill-evaluator/fixtures/confirmatory-authority-boundary-07.md",
      "root": "campaign",
      "schema_version": "text/utf-8"
    },
    {
      "path": "evaluation/model-evolution/confirmatory-v1/sentinels/skill-evaluator/fixtures/confirmatory-authority-boundary-08.md",
      "root": "campaign",
      "schema_version": "text/utf-8"
    },
    {
      "path": "evaluation/model-evolution/confirmatory-v1/sentinels/skill-evaluator/fixtures/confirmatory-cli-schema-owner-01.md",
      "root": "campaign",
      "schema_version": "text/utf-8"
    },
    {
      "path": "evaluation/model-evolution/confirmatory-v1/sentinels/skill-evaluator/fixtures/confirmatory-cli-schema-owner-02.md",
      "root": "campaign",
      "schema_version": "text/utf-8"
    },
    {
      "path": "evaluation/model-evolution/confirmatory-v1/sentinels/skill-evaluator/fixtures/confirmatory-cli-schema-owner-03.md",
      "root": "campaign",
      "schema_version": "text/utf-8"
    },
    {
      "path": "evaluation/model-evolution/confirmatory-v1/sentinels/skill-evaluator/fixtures/confirmatory-cli-schema-owner-04.md",
      "root": "campaign",
      "schema_version": "text/utf-8"
    },
    {
      "path": "evaluation/model-evolution/confirmatory-v1/sentinels/skill-evaluator/fixtures/confirmatory-cli-schema-owner-05.md",
      "root": "campaign",
      "schema_version": "text/utf-8"
    },
    {
      "path": "evaluation/model-evolution/confirmatory-v1/sentinels/skill-evaluator/fixtures/confirmatory-cli-schema-owner-06.md",
      "root": "campaign",
      "schema_version": "text/utf-8"
    },
    {
      "path": "evaluation/model-evolution/confirmatory-v1/sentinels/skill-evaluator/fixtures/confirmatory-cli-schema-owner-07.md",
      "root": "campaign",
      "schema_version": "text/utf-8"
    },
    {
      "path": "evaluation/model-evolution/confirmatory-v1/sentinels/skill-evaluator/fixtures/confirmatory-cli-schema-owner-08.md",
      "root": "campaign",